लंबी प्रश्नावली,सीसीए का नाम,गांव,पंचायत,देश,स्थान,क्षेत्रफल (हेक्टेयर में),पारिस्थितिकी तंत्र प्रकार,पारिस्थितिकी तंत्र - अधिक जानकारी,समुदाय,परिवारों की संख्या,लोगों की संख्या,उत्पत्ति,इतिहास,गठन की तिथि,प्रेरणाएँ,प्रेरणाएँ - अतिरिक्त विवरण,सीसीए का संघ या समूह,सीसीए का संघ या समूह - अतिरिक्त विवरण,सम्मिलित लोग,निर्णय लेने वाली संस्था,नियमों और विनियमों का स्वरूप,नियम और विनियम - अतिरिक्त विवरण,वर्ष के दौरान सामुदायिक गतिविधियाँ,पारिस्थितिक बहाली और जैव विविधता संरक्षण,कानूनी स्थिति,एफआरए प्रयोज्यता,सामुदायिक वन अधिकार (सीएफआर),सीएफआर दावा दाखिल करने की तिथि,सीएफआर दावे का स्तर,सीएफआर दावे की मान्यता की तिथि,सीएफआर-अतिरिक्त विवरण,प्रबंधन योजना की स्थिति,भूमि स्वामित्व,अन्य मान्यता प्राप्त दर्जा,पवित्र स्थल,कानूनी और अन्य मान्यताएं - अतिरिक्त विवरण,आजीविका और निर्वाह पर प्रभाव,सामाजिक प्रभाव,पारिस्थितिक प्रभाव,प्रभाव - अतिरिक्त विवरण,अवसर,आंतरिक खतरे और चुनौतियाँ,बाहरी खतरे और चुनौतियाँ,खतरे और चुनौतियाँ- अतिरिक्त विवरण,आवश्यकताएँ,भविष्य की योजनाएं,सूचना स्रोत,सूचना प्रदाता,अध्ययन की तिथि,लाइसेंस,विशिष्ट शब्दों की शब्दावली,संदर्भ,समाचार और अपडेट,मल्टीमीडिया
1,भामदरा,नारो का खेड़ा,गोडान कला,भारत,"73,7125|24.5854",16.44,वन | घास के मैदान,बरसाती नाला पास मे,भील,75,400,पारंपरिक प्रथाओं पर आधारित,,1998,प्राकृतिक आवास और प्रजातियों के संरक्षण हेतू | आजीविका हेतू | कृषि और पशुधन विविधता संरक्षण हेतू | बाहरी खतरे के जवाब हेतू,,नारो का खेड़ा,,400,ग्राम सभा | पंचायत,अनौपचारिक,ग्राम समूह के नियम लागु होते है,मृदा और जल संरक्षण | बाड़ लगाना,,राजस्व भूमि / चारागाह भूमि,,,,,,,,,,,,चारा कटाई,सामजिक शशक्ति करण | बाहरी खतरे में कमी | संकट प्रवास में रोकथाम,,,ग्राम सभा,,भूमि स्वामित्व या कार्यकाल संबंधित मुद्दे,,समुदाय को चारागाह की जरूरत है |,आमदनी के लिए फलदार पौधे लगाने की योजना |,पूरे समुदाय की भागीदारी और सहमति के माध्यम से,"मोहन जी, चुन्नीलाल जी, कमला जी, पूना जी, धापू बाई, लक्ष्मी बाई",16.8.23,,,,,
2,कायलों का गुडा 2,कायलों का गुडा,गोड़न कला,भारत,"73,7125|24.5854",13.85,वन | घास के मैदान,वन और घास,भील,60,300,पारंपरिक प्रथाओं पर आधारित,सेवा मंदिर और ग्राम समूह के द्वारा निकाला गया,1998,आजीविका हेतू | कृषि और पशुधन विविधता संरक्षण हेतू | बाहरी खतरे के जवाब हेतू,,उदा खादरा,चेन का भिवाड़ा,300,ग्राम सभा,अनौपचारिक,,वृक्षारोपण और बहाली गतिविधियाँ | मृदा और जल संरक्षण | अतिक्रमण हटाना | पूर्ण चरागाह निर्माण करना,,राजस्व भूमि / चारागाह भूमि,,,,,,,,,,,,चारा कटाई | चराई | जलाऊ लकड़ी,सामुदायिक सशक्तिकरण | बाहरी खतरे में कमी | संकट प्रवास में रोकथाम,प्राकृतिक आवास में सुधार और बहाली,,ग्राम सभा,शहरीकरण से खतरा,अवांछित विकास संबंधित दबाव | जैव विविधता या प्रकृति की गुणवत्ता या मात्रा में गिरावट,खरपतवार होने से पोधो का नष्ट होना,समुदाय को चारागाह की जरूरत है जल और जमीन बचाना है |,सेवा मंदिर के द्वारा सहयोग मिले ताकि आगे इसका विस्तार हो |,सार्वजनिक रूप से उपलब्ध स्रोतों से | समुदाय के सदस्य/सदस्यों द्वारा,"अमालाल जी, मेगा जी, भनराम जी, हरीश जी",18.8.23,,,,,
3,तीन मुंडा,कायलों का गुडा,गोड़न कला,भारत,"73,7125|24.5854",11.68,वन | अन्य|पर्वतीय,,भील,60,300,पारंपरिक प्रथाओं पर आधारित,,1998,आजीविका हेतू | स्व-सशक्तिकरण हेतू | बाहरी खतरे के जवाब हेतू | कृषि और पशुधन विविधता संरक्षण हेतू,,चेन का भिवाड़ा,,300,ग्राम सभा,अनौपचारिक,ग्राम समूह के नियम लागु होते है,अग्नि प्रबंधन | मृदा और जल संरक्षण,,,,,,,,,,,,,,चारा कटाई | चराई,संकट प्रवास में रोकथाम | बाहरी खतरे में कमी,वन्यजीवों की विविधता और जनसंख्या में वृद्धि,,,जैव विविधता और इसके मूल्य के बारे में जागरूकता में कमी,,यु आई टी के कब्जे के कारण स्वामित्व खतम हो रहा है |,,,समुदाय के सदस्य/सदस्यों द्वारा,"अमालाल जी, मेगा जी, हरीश जी",24.8.23,,,,,
4,शोभावातो की भागल 1,शोभावातो की भागल,अंटालिया,भारत,"73,7125|24.5854",11,वन | घास के मैदान | पर्वतीय,"चारागाह में अधिकांश रूप से घास,थोडा वन क्षेत्र एवं पर्वतीय क्षेत्र है |",राजपूत समुदाय,35,250,समुदाय द्वारा नई पहल | बाह्य गैर सरकारी एजेंसी द्वारा नई पहल,वर्ष 2011 में सेवा मंदिर द्वारा समुदाय के साथ बेथ्को के माध्यम से जुडाव रहा इसी दौरान चारागाह के प्रबंध व्यवथा को लेकर कार्य किया गया |,Jan-11,आजीविका हेतू | पारिस्थितिकी कार्य हेतू | स्व-सशक्तिकरण हेतू | प्राकृतिक आवास और प्रजातियों के संरक्षण हेतू | वन्य जैव विविधता संरक्षण | कृषि और पशुधन विविधता संरक्षण हेतू | बाहरी खतरे के जवाब हेतू,सेवा मंदिर द्वारा समुदाय के लोगो को अन्य कार्य क्षेत्र की विजिट करने पर लोगो के विचारो में परिवर्तन हुआ |,हाँ,सी.सी.ए का संग समूह एक ग्राम विकास कमिटी है जो की समुदाय आधारित सर्व सामूहिक कार्यो पर कार्य करती है जिसको सेवा मंदिर द्वारा तयार किया जाता है |,"समुदाय ,ग्राम विकास कमिटी,क्षेत्रीय विकास मंच,फेडरेशन,स्वयं सहायता समूह",पंचायत | संसाधन उपयोगकर्ता | महिला समिति | ग्राम विकास कमिटी | फेडरेशन,औपचारिक,"क़ानूनी कार्यवाही ,जी वि सी बेठक द्वारा निर्णय एवं नियमावली","अग्नि प्रबंधन | मृदा और जल संरक्षण | पेट्रोलिंग, वॉच और वार्ड | उत्पाद विनियमन | वृक्षारोपण और बहाली गतिविधियाँ | मृदा और जल संरक्षण | बाड़ लगाना 8) अतिक्रमण हटाना",,अन्य | राजस्व भूमि / चारागाह भूमि,हाँ,,,,,,चारागाह की प्रबन्ध व्यवस्था ग्राम समूह के अधीन है जिसमे सभी प्रकार के प्रबंध व्यवथा के निर्णय ग्राम विकास कमिटी द्वारा लिए जाते है |,सरकारी स्वामित्व | राजस्व विभाग | समुदाय का स्वामित्व,,हाँ,,चारा कटाई | चराई | जलाऊ लकड़ी,सामुदायिक सशक्तिकरण | महिलाओं/युवाओं/वंचित वर्गों का सशक्तिकरण | सुनिश्चित भूमि स्वामित्व या भू-पहुंच | बाहरी खतरे में कमी | संकट प्रवास में रोकथाम, प्राकृतिक आवास में सुधार और बहाली | वन्यजीवों की विविधता और जनसंख्या में वृद्धि | जल आपूर्ति और मिट्टी की उर्वरता जैसी पारिस्थितिक सेवाओं में सुधार,चारागाह प्रबंधन कार्य से समुदाय में सशक्तिकरण हुआ है साथ ही प्रबध व्यवथा में लोगो की रूचि बदने लगी है जिसमे यूवा बुजर्गो महिलाओ सबकी भागीदारी रही है |,,अन्य समुदायों के साथ संघर्ष | जैव विविधता और इसके मूल्य के बारे में जागरूकता में कमी | संसाधनों की कमी और गरीबी का दबाव | अधिक कटाई समुदाय के भीतर से 5)पलायन,प्रतिबंधात्मक कानून और नीतियां | भूमि स्वामित्व या कार्यकाल संबंधित मुद्दे | अवांछितनिष्कर्षण | जैव विविधता या प्रकृति की गुणवत्ता या मात्रा में गिरावट | जलवायु परिवर्तन प्रभाव | आक्रामक या गैर-देशी प्रजातियां,बहरी गेर समुदाय द्वारा कब्ज़ा करना |,चारागाह में जल ग्रहण कार्य की आवश्यकता है |,आमदनी के लिए फलदार पौधे लगाने की योजना |,समुदाय के सदस्य/सदस्यों द्वारा | पूरे समुदाय की भागीदारी और सहमति के माध्यम से,,,,,,,
5,पूर्वजो की भागल,पूर्वजो की भागल,अंटालिया,भारत,"73,7125|24.5854",15,वन | घास के मैदान | पर्वतीय,"चारागाह में अधिकांश रूप से घास,थोडा वन क्षेत्र एवं पर्वतीय क्षेत्र है |",राजपूत समुदाय,25,150,समुदाय द्वारा नई पहल | बाह्य गैर सरकारी एजेंसी द्वारा नई पहल,वर्ष 2013 में सर्व प्रथम सेवा मंदिर से जुडाव के दौरान कमिटी का निर्माण किया गया जिसमे समुदाय द्वारा चारागाह चक कार्य प्रबंध व्यवस्था बॉउंड्री कार्य वृक्षारोपण पर चर्चा कर कार्य चालू किया गया |,2013,आजीविका हेतू | पारिस्थितिकी कार्य हेतू | स्व-सशक्तिकरण हेतू | प्राकृतिक आवास और प्रजातियों के संरक्षण हेतू | वन्य जैव विविधता संरक्षण | कृषि और पशुधन विविधता संरक्षण हेतू | बाहरी खतरे के जवाब हेतू,सेवा मंदिर द्वारा समुदाय के लोगो को अन्य कार्य क्षेत्र की विजिट करने पर लोगो के विचारो में परिवर्तन हुआ |,हाँ,1)जी.वि.सी 2)फेडरेशन 3)महिला स्वयं सहायता समूह,"समुदाय ,ग्राम विकास कमिटी,क्षेत्रीय विकास मंच,फेडरेशन,स्वयं सहायता समूह",पंचायत | संसाधन उपयोगकर्ता | महिला समिति | ग्राम विकास कमिटी | फेडरेशन,,"क़ानूनी कार्यवाही ,जी वि सी बेठक द्वारा निर्णय एवं नियमावली","उत्पाद विनियमन | पेट्रोलिंग, वॉच और वार्ड | वृक्षारोपण और बहाली गतिविधियाँ | मृदा और जल संरक्षण | बाड़ लगाना | अतिक्रमण हटाना",,अन्य | राजस्व भूमि / चारागाह भूमि,,,,,,,"चारागाह प्रबंध व्यवस्था समुदाय ग्राम विकास कमिटी के निर्णयों द्वारा रहती है जिसमे मासिक श्रमदान,चोकिदारी आदि है |",सरकारी स्वामित्व | राजस्व विभाग | समुदाय का स्वामित्व,,,,चारा कटाई | चराई | जलाऊ लकड़ी,सामुदायिक सशक्तिकरण | महिलाओं/युवाओं/वंचित वर्गों का सशक्तिकरण | सुनिश्चित भूमि स्वामित्व या भू-पहुंच | बाहरी खतरे में कमी | संकट प्रवास में रोकथाम, प्राकृतिक आवास में सुधार और बहाली | वन्यजीवों की विविधता और जनसंख्या में वृद्धि | जल आपूर्ति और मिट्टी की उर्वरता जैसी पारिस्थितिक सेवाओं में सुधार,चारागाह प्रबंधन कार्य से समुदाय में सशक्तिकरण हुआ है साथ ही प्रबध व्यवथा में लोगो की रूचि बदने लगी है जिसमे यूवा बुजर्गो महिलाओ सबकी भागीदारी रही है |,,अन्य समुदायों के साथ संघर्ष | जैव विविधता और इसके मूल्य के बारे में जागरूकता में कमी | संसाधनों की कमी और गरीबी का दबाव | अधिक कटाई समुदाय के भीतर से 5)पलायन,जैव विविधता या प्रकृति की गुणवत्ता या मात्रा में गिरावट | जलवायु परिवर्तन प्रभाव,बहरी गेर समुदाय द्वारा कब्ज़ा करना |,"चारागाह पर नाम समुदाय कार्यकारी संस्था एजेंसी का बोर्ड लगवाना, जल सरक्षण, वृक्षारोपण, फलदार पौधों का वृक्षारोपण",,समुदाय के सदस्य/सदस्यों द्वारा | पूरे समुदाय की भागीदारी और सहमति के माध्यम से,,,,,,,
